{
  "tree_id": "metro-apartment-leasing-2026Q4",
  "objective": "在工业产权→保租房通道下，用 300 万装修出资与 100 万履约押金运营 75 间长租公寓：甲方于 48 个月内收回装修出资，乙方在 8 年合同期内取得正经营现金流并保全押金。本树为双侧结构 —— 甲方口径（资本回收）与乙方口径（经营现金流）不可合并，因为两者对同一驱动变量（分成比例）的最优方向相反。",
  "instrumentation": [
    "签约合同原件（纸质双签 + 电子存档）→ 甲方财务；字段：房型、建筑面积、折后月租、优惠类型、起租日、渠道首触来源",
    "资金监管账户流水（银行） → 甲方财务；唯一权威收入口径，与台账差异 >2% 即触发审计",
    "门禁与智能锁通行记录（门禁系统） → 运维；用于交叉验证真实在租间数，防止台账虚增",
    "水电用量抄表（智能水电表） → 运维；空置房用电量接近零，可识别『签约未入住』被计入在租",
    "到访登记簿（现场手签） + CRM 到访记录 → 运营；CRM 与手签差异即为渠道虚报量",
    "投放后台账单（贝壳/安居客端口、抖音本地、小红书信息流后台） → 运营；CAC 分子来源",
    "渠道结算单与佣金支付凭证 → 财务；『渠道成交间数』的分母口径依据",
    "预登记表单系统（问卷平台） → 运营；画像权重 P1–P5 的唯一数据来源",
    "月度分红台账（双方签章） → 甲方财务；分红金额以监管账户流水为准",
    "乙方损益台账 + 原始凭证（工资表、社保记录、维保合同、客服工单） → 乙方财务；甲方有权抽查",
    "合规台账（备案回执、消防验收、登记簿、专责人员名单） → 甲方合规；开业前 100% 核验"
  ],
  "attribution_assumption": "渠道归因采用『末次点击 + 60 天回溯窗口』作为操作口径，因其可从 CRM 首触/末触字段自动计算；但末次点击会系统性高估临近签约的渠道（自然到访、老带新转介绍），故每季度以预登记问卷的『信息来源渠道』自报数据做一次校准，两口径差异 >20% 时以问卷口径为准。★本项目的签约量在 6 个月内仅 66–70 间次，任何渠道间的效果差异都不具备统计显著性 —— 渠道结论只能作为方向性判断，不可用于宣称因果提升（依据 MARKETING_OS『Attribution and incrementality』）。CAC 必须声明成本口径：本树以『广义口径』（开业期全部营销支出）为准，品牌与内容支出亦计入分子，因为在该规模下无法区分品牌投入与获客投入的边际贡献。",
  "nodes": [
    {
      "metric_name": "甲方装修出资回收进度（北极星·甲方口径）",
      "metric_type": "outcome",
      "definition": "分子=甲方自开业起累计实际收到的月度分红款（含优先受偿与比例分成）；分母=装修出资 300 万元。分母为固定值，不随出租率变化。",
      "unit": "%，累计",
      "period": "月度（每月 10 日前对账）",
      "source_of_truth": "资金监管账户流水 + 双方签章的月度分红台账（双签后以监管账户流水为准）",
      "owner": "甲方财务负责人 / 乙方运营负责人 双签",
      "formula": "累计分红 ÷ 3,000,000；文档另给『回本周期 ≤30 个月』的等价表述",
      "baseline": "0%（2026-10-12 尚未签约，无历史值）",
      "target": "第 24 月 ≥40%、第 36 月 ≥75%、第 48 月 =100%（硬约束）",
      "limitations": [
        "本模型复算：65% 分成 + 前 5 月爬坡下第 48 月无法达成，实测回本约第 37 月的前提是稳态 90% 且无爬坡损失叠加",
        "文档执行摘要的 1.9 年无法由任何 65% 分成档位复现（见 scripts/01）"
      ],
      "children": [
        {
          "metric_name": "月度可分配收入（甲方口径）",
          "metric_type": "driver",
          "definition": "分子=当月实际租金收入（按签约台账应收） − 当月运营杂费（200 元/间 × 实际在租间数） − 当月增值税及附加；分母=1（金额型指标）。不扣房产税以外的任何乙方成本。",
          "unit": "元/月",
          "period": "月度",
          "source_of_truth": "签约台账 + 收款流水 + 开票记录",
          "owner": "乙方运营负责人",
          "formula": "Σ(各房型在租间数 × 该房型月租) − 200 × 在租间数 − 租金收入 × 1.68%",
          "baseline": "0 元（未开业）",
          "target": "稳态 ≥131,284 元/月（90% 出租率、架构一税负）",
          "limitations": [
            "『运营杂费是否按实际在租间数扣减』两份源文档口径不一致，差额在低出租率下达 3,900 元/月"
          ],
          "children": [
            {
              "metric_name": "在租间数",
              "metric_type": "driver",
              "definition": "分子=统计时点已签约且在租的房屋间数（不含已签约未入住、不含空置保留间）；分母=1（计数）。",
              "unit": "间",
              "period": "日更新、月度结算",
              "source_of_truth": "签约台账 + 门禁/水电用量交叉验证",
              "owner": "乙方运营负责人",
              "formula": "Σ在租合同对应的房屋间数",
              "baseline": "0 间",
              "target": "第 6 月 ≥66 间、第 12 月 ≥70 间、稳态 ≥68 间（90%）",
              "limitations": [
                "乙方自报台账存在多报动机，须以门禁记录与水电用量交叉验证"
              ]
            },
            {
              "metric_name": "签约均价（实际）",
              "metric_type": "driver",
              "definition": "分子=当月新签合同的折后月租金合计（含企业批量让价、开业优惠、免租期折算后）；分母=当月新签合同间数。不含物业费与增值服务收入。",
              "unit": "元/间·月",
              "period": "月度（按签约日归集）",
              "source_of_truth": "签约合同原件 + 收款流水（以合同原件为准，优惠须书面留痕）",
              "owner": "乙方运营负责人 / 甲方财务复核",
              "formula": "Σ折后月租 ÷ 新签间数",
              "baseline": "无（未开业）",
              "target": "首年综合 ≥2,182 元/间·月（=分层定价加权值）",
              "limitations": [
                "文档第七章另设『12 个月不低于 2,182 元』与『开业 6 个月均价不低于 2,300 元』两条，2,300 元对应 94.5 元/㎡·月，将突破 90 元/㎡·月合规基线，二者不能同时作为目标"
              ]
            },
            {
              "metric_name": "甲方分成比例（执行值）",
              "metric_type": "driver",
              "definition": "分子=甲方当月实收分红；分母=当月可分配收入。该比例是合同条款变量，非经营结果。",
              "unit": "%",
              "period": "月度",
              "source_of_truth": "合作协议 + 分红台账",
              "owner": "甲方投资决策人",
              "formula": "甲方实收 ÷ 可分配收入",
              "baseline": "未签约；营销全案提案 65%（阶段一）/ 合作模式报告提案 35%（阶段 B2）",
              "target": "阶段一 ≥65%，阶段 B1 ≥40%，阶段 B2 ≥35%（待重谈）",
              "limitations": [
                "★口径冲突：营销全案 1.3 节写『甲方分成 65%』，合作模式报告 3.1 节写阶段 B2『甲方 35%』，两份文档对同一时期给出相反比例，签约前必须明确哪个是最终条款"
              ]
            },
            {
              "metric_name": "分红打款及时率",
              "metric_type": "diagnostic",
              "definition": "分子=在约定日（每月 10 日）前完成打款的分红期数；分母=应打款期数。",
              "unit": "%",
              "period": "月度",
              "source_of_truth": "资金监管账户流水",
              "owner": "甲方财务负责人",
              "baseline": "无（未开业）",
              "target": "≥95%（12 个月内至少 11 期按时）",
              "guardrail_threshold": "连续 2 期逾期未打款即触发专项复盘并启动押金抵扣"
            },
            {
              "metric_name": "台账与监管流水一致性",
              "metric_type": "diagnostic",
              "definition": "分子=月度台账租金总额与资金监管账户入账总额差异 ≤2% 的月份数；分母=已结算月份数。",
              "unit": "%",
              "period": "月度",
              "source_of_truth": "资金监管账户流水（以流水为准）",
              "owner": "甲方财务负责人",
              "baseline": "无",
              "target": "100%",
              "guardrail_threshold": "任一月份差异 >5% 即暂停分红打款并专项审计"
            }
          ]
        },
        {
          "metric_name": "回本时间（实测）",
          "metric_type": "driver",
          "definition": "分子=自开业月（第 1 个有租金收入的完整月）起累计月份数；分母=1（时间型指标）。终点事件=累计分红首次 ≥3,000,000 元的月份。",
          "unit": "月",
          "period": "月度累计",
          "source_of_truth": "分红台账 + 银行流水",
          "owner": "甲方投资决策人",
          "formula": "min{ m : Σ(第1..m月分红) ≥ 3,000,000 }",
          "baseline": "无（未开业）",
          "target": "≤48 个月（合作模式报告前置硬约束）；文档第七章另称 ≤30 个月",
          "guardrail_threshold": "第 18 月进度 <25% 或第 36 月 <60% 时触发重谈条款",
          "limitations": [
            "48 个月与 30 个月两个目标差异巨大（相差 60 万级分红），须择一写入合同"
          ]
        }
      ]
    },
    {
      "metric_name": "乙方运营月度经营现金流（北极星·乙方口径）",
      "metric_type": "outcome",
      "definition": "分子=当月乙方分成收入（可分配收入 × 乙方分成比例，或按瀑布规则应得额） − 当月乙方自有运营成本（人力/公区能耗/保洁/维保/营销/坏账/办公）；分母=1（金额型指标）。不含押金本金与押金机会成本。",
      "unit": "元/月",
      "period": "月度",
      "source_of_truth": "乙方损益台账（须逐项附凭证）+ 分红台账交叉核对",
      "owner": "乙方运营负责人",
      "formula": "乙方分成收入 − 乙方自有运营成本合计",
      "baseline": "无（未开业）；本模型重建基准 -44,523 元/月（90% 出租率、营销全案 65/35 口径）",
      "target": "★当前条款下达不到正值，须先重谈分成结构再设目标（见 limitations）",
      "guardrail_threshold": "连续 3 个月经营现金流为负且累计亏损 >30 万时，触发重谈或退出条款",
      "limitations": [
        "★本次诊断的核心发现：按营销全案 65/35，乙方单间月收入仅 681 元，而单间月运营成本 771–1,513 元 —— 结构性缺口。四种口径下最乐观者年化回报仅 7.6%，低于长租公寓运营商 10–15% 门槛（合作模式报告 5.1 自述）",
        "乙方投入为 100 万履约押金（不计息、期满退还），其『回本』概念与甲方 300 万装修出资不同口径，不可混用"
      ],
      "children": [
        {
          "metric_name": "乙方分成收入",
          "metric_type": "driver",
          "definition": "分子=当月按约定瀑布规则应归乙方的金额（金额型）；分母=1。",
          "unit": "元/月",
          "period": "月度",
          "source_of_truth": "合作协议 + 分红台账",
          "owner": "乙方运营负责人",
          "formula": "阶段A：可分配收入 − 甲方当月优先受偿额；阶段B1：可分配收入 × 60%；阶段B2：可分配收入 × 65%",
          "baseline": "无",
          "target": "≥当月自有运营成本（保本线）",
          "limitations": [
            "反解：保本需乙方分成 ≥68.9%，而文档给定 35%"
          ]
        },
        {
          "metric_name": "乙方自有运营成本合计",
          "metric_type": "driver",
          "definition": "分子=人力+公区水电网络+保洁消杀+维修维保+营销推广+坏账计提+办公财税之和；分母=1（金额型）。不含运营杂费 200 元/间·月（该笔归属未定，见护栏节点）。",
          "unit": "元/月",
          "period": "月度",
          "source_of_truth": "乙方财务凭证 + 银行流水（甲方有权抽查）",
          "owner": "乙方运营负责人",
          "formula": "Σ(各成本项)",
          "baseline": "文档给定 57,800 元/月（无明细）；本模型自下而上重建 90,473 元/月",
          "target": "≤57,800 元/月（按合作模式报告第九章要求，签约前提交逐项书面预算）",
          "guardrail_threshold": "月度实际成本超预算 15% 且连续 2 个月，触发成本专项审计",
          "limitations": [
            "文档 57,800 元/月无明细项，且与营销全案 1.1『人工与运营招商费用由乙方另列』矛盾；差异达 32,673 元/月（+57%）。这是本项目最大的单一不确定项"
          ],
          "children": [
            {
              "metric_name": "单间月运营成本",
              "metric_type": "diagnostic",
              "definition": "分子=乙方自有运营成本合计；分母=实际在租间数。",
              "unit": "元/间·月",
              "period": "月度",
              "source_of_truth": "同上",
              "owner": "乙方运营负责人",
              "formula": "自有运营成本合计 ÷ 在租间数",
              "baseline": "文档口径 771 元/间·月（57,800÷75）；本模型 1,206 元/间·月",
              "target": "≤771 元/间·月（即在租 75 间口径）",
              "guardrail_threshold": ">1,000 元/间·月 时单间贡献为负"
            },
            {
              "metric_name": "人力成本",
              "metric_type": "diagnostic",
              "definition": "分子=店长/管家/维修/保洁主管等在编与非编人员的应发薪酬+社保公积金；分母=1。",
              "unit": "元/月",
              "period": "月度",
              "source_of_truth": "工资表 + 社保缴纳记录",
              "owner": "乙方运营负责人",
              "baseline": "无；本模型补 45,000 元/月（敏感区间 32,000–55,000）",
              "target": "≤45,000 元/月",
              "guardrail_threshold": ">55,000 元/月 时须书面说明编制依据"
            },
            {
              "metric_name": "营销推广支出",
              "metric_type": "diagnostic",
              "definition": "分子=当月媒体投放+渠道佣金+活动物料的实际支付额；分母=1。",
              "unit": "元/月",
              "period": "月度",
              "source_of_truth": "投放后台账单 + 渠道结算单",
              "owner": "乙方运营负责人",
              "baseline": "开业期一次性 40 万；溢价期起 25,000 元/月",
              "target": "开业期累计 ≤400,000 元；稳态 ≤25,000 元/月",
              "guardrail_threshold": "累计超预算 10% 即冻结投放并复盘"
            }
          ]
        },
        {
          "metric_name": "押金安全垫月数",
          "metric_type": "guardrail",
          "definition": "分子=履约押金本金余额（1,000,000 元 − 已抵扣额）；分母=近 3 个月平均月度经营现金流亏损额。经营现金流为正时该指标记为『不适用/无风险』。",
          "unit": "月",
          "period": "月度",
          "source_of_truth": "押金专户余额 + 乙方损益台账",
          "owner": "双方财务负责人",
          "formula": "押金余额 ÷ |近3月平均月度经营现金流|",
          "baseline": "无（未开业）；本模型重建：稳态 90% 时 22 个月",